{
  "$schema": "http://json-schema.org/draft-07/schema#",
  "$id": "https://buona.shanley.dev/schemas/config.schema.json",
  "title": "Buona Config",
  "description": "Global configuration for buona (~/.config/buona/config.json).",
  "type": "object",
  "required": ["workspace_dir"],
  "additionalProperties": false,
  "properties": {
    "$schema": {
      "type": "string"
    },
    "workspace_dir": {
      "type": "string",
      "description": "Root directory where workspaces are stored. Supports ~ for the home directory.",
      "default": "~/workspace"
    },
    "ide": {
      "type": "string",
      "description": "The user's preferred IDE.",
      "enum": ["vscode", "cursor", "windsurf"],
      "default": "vscode"
    },
    "git": {
      "type": "object",
      "description": "Default git settings.",
      "additionalProperties": false,
      "properties": {
        "host": {
          "type": "string",
          "description": "The git host (e.g. \"github.com\" or a GitHub Enterprise host).",
          "default": "github.com"
        },
        "organization": {
          "type": "string",
          "description": "The default organization on the host (e.g. \"my-org\").",
          "default": ""
        },
        "protocol": {
          "type": "string",
          "description": "The protocol used to clone and push.",
          "enum": ["ssh", "https"],
          "default": "ssh"
        },
        "tracking": {
          "type": "string",
          "description": "Default git tracking mode for workspaces. \"package\" means each package has its own .git. \"workspace\" means a single .git at the workspace root.",
          "enum": ["package", "workspace"],
          "default": "package"
        }
      }
    },
    "default_packages": {
      "type": "array",
      "description": "Package specifiers added to new workspaces by default.",
      "items": {
        "type": "string"
      },
      "default": []
    },
    "workspace_template": {
      "type": ["string", "null"],
      "description": "Optional template directory copied into new workspaces. Supports ~ for the home directory."
    }
  }
}
